{
  "card_type": "experiment",
  "id": "exp:gh-full-idf-v0",
  "name": "GitHub full-text cross-repo de-referenced — idf-cosine",
  "created_at": "2026-06-21T00:00:00Z",
  "hypothesis": "Does IDF over full body text beat vanilla, and does the extra (de-truncated) text move the bag-of-tokens bar?",
  "task": "issue_to_fixing_pr",
  "dataset_version": "ds:gh-full-v0",
  "code_version": "relsdlc-0.1.0",
  "seed": 0,
  "command": "python data/full/run_full_ablation.py",
  "system": "idf-cosine",
  "runtime_class": "cpu",
  "metrics": {
    "recall_at_k": {
      "1": 0.5092,
      "5": 0.8672,
      "10": 0.9631
    },
    "mrr": 0.6673,
    "hard_negative_accuracy": 0.524,
    "n_queries": 271
  },
  "baseline_comparison": "exp:gh-full-vanilla-v0",
  "error_slices": [],
  "leakage_checks": [
    "references scrubbed from text; train repos disjoint from test repos (cross-repo generalization); embeddings frozen (no fit on test repos)."
  ],
  "known_limitations": [
    "Pilot scale; full body text (up to 8000 chars) but frozen general-text embedder (not code-specific). Exploratory."
  ],
  "exploratory": true
}
