{
  "card_type": "experiment",
  "id": "exp:gh-gnn-diff2test-lora-embed-v0",
  "name": "GNN probe — diff2test cross-repo — lora embedder-cosine",
  "created_at": "2026-06-21T00:00:00Z",
  "hypothesis": "On the de-referenced cross-repo split, does training-free typed graph aggregation add retrieval signal beyond pairwise text cosine on pretrained node features?",
  "task": "diff_to_affected_test",
  "dataset_version": "ds:gh-pilot-v0",
  "code_version": "relsdlc-0.1.0",
  "seed": 0,
  "command": "python data/pilot/run_gnn_ablation.py",
  "system": "embedder-cosine (lora)",
  "runtime_class": "cpu",
  "metrics": {
    "recall_at_k": {
      "1": 0.0089,
      "5": 0.1746,
      "10": 0.7049
    },
    "mrr": 0.1553,
    "hard_negative_accuracy": 0.0893,
    "n_queries": 112
  },
  "baseline_comparison": "exp:gh-gnn-diff2test-frozen-embed-v0",
  "error_slices": [],
  "leakage_checks": [
    "test-file nodes have no text embedding (zero vector) — cosine cannot represent them; this is the honest baseline."
  ],
  "known_limitations": [
    "pilot scale; TRAINING-FREE mean aggregation (no learned GNN weights); frozen/LoRA node features; exploratory probe, not the final word — a learned R-GCN is the follow-up if structure shows signal."
  ],
  "exploratory": true
}
