{
  "card_type": "experiment",
  "id": "exp:gh-full-embed-cosine-v0",
  "name": "GitHub full-text cross-repo de-referenced — embedder-cosine",
  "created_at": "2026-06-21T00:00:00Z",
  "hypothesis": "Frozen sentence-transformers/all-MiniLM-L6-v2 @ max_length=512 on full body text, raw cosine (no training) — how much does using more of the body lift cross-repo R@1?",
  "task": "issue_to_fixing_pr",
  "dataset_version": "ds:gh-full-v0",
  "code_version": "relsdlc-0.1.0",
  "seed": 0,
  "command": "python data/full/run_full_ablation.py",
  "system": "embedder-cosine",
  "runtime_class": "cpu",
  "metrics": {
    "recall_at_k": {
      "1": 0.5461,
      "5": 0.9004,
      "10": 0.9815
    },
    "mrr": 0.6957,
    "hard_negative_accuracy": 0.5572,
    "n_queries": 271
  },
  "baseline_comparison": "exp:gh-full-idf-v0",
  "error_slices": [],
  "leakage_checks": [
    "references scrubbed from text; train repos disjoint from test repos (cross-repo generalization); embeddings frozen (no fit on test repos)."
  ],
  "known_limitations": [
    "Pilot scale; full body text (up to 8000 chars) but frozen general-text embedder (not code-specific). Exploratory."
  ],
  "exploratory": true
}
